{"_D":"urn:oasis:names:specification:ubl:schema:xsd:OrderResponseSimple-2",
 "_A":"urn:oasis:names:specification:ubl:schema:xsd:CommonAggregateComponents-2",
 "_B":"urn:oasis:names:specification:ubl:schema:xsd:CommonBasicComponents-2",
 "OrderResponseSimple":[{
 "UBLVersionID":[{"_":"2.0"}],
 "CustomizationID":[{"_":"urn:oasis:names:specification:ubl:xpath:OrderResponseSimple-2.0:sbs-1.0-draft"}],
 "ProfileID":[{"_":"bpid:urn:oasis:names:draft:bpss:ubl-2-sbs-order-with-simple-response-draft"}],
 "ID":[{"_":"66890-9-09"}],
 "CopyIndicator":[{"_":false}],
 "UUID":[{"_":"569ED478-0EBE-4817-A234-DFB9ACA81218"}],
 "IssueDate":[{"_":"2005-06-20"}],
 "Note":[{"_":"sample"}],
 "AcceptedIndicator":[{"_":true}],
 "OrderReference":[{
  "ID":[{"_":"AEG012345"}],
  "SalesOrderID":[{"_":"CON0095678"}],
  "UUID":[{"_":"6E09886B-DC6E-439F-82D1-7CCAC7F4E3B1"}],
  "IssueDate":[{"_":"2005-06-20"}]
 }],
 "SellerSupplierParty":[{
  "CustomerAssignedAccountID":[{"_":"CO001"}],
  "Party":[{
   "PartyName":[{
    "Name":[{"_":"Consortial"}]
   }],
   "PostalAddress":[{
    "StreetName":[{"_":"Busy Street"}],
    "BuildingName":[{"_":"Thereabouts"}],
    "BuildingNumber":[{"_":"56A"}],
    "CityName":[{"_":"Farthing"}],
    "PostalZone":[{"_":"AA99 1BB"}],
    "CountrySubentity":[{"_":"Heremouthshire"}],
    "AddressLine":[{
     "Line":[{"_":"The Roundabout"}]
    }],
    "Country":[{
     "IdentificationCode":[{"_":"GB"}]
    }]
   }],
   "PartyTaxScheme":[{
    "RegistrationName":[{"_":"Farthing Purchasing Consortium"}],
    "CompanyID":[{"_":"175 269 2355"}],
    "ExemptionReason":[{"_":"N/A"}],
    "TaxScheme":[{
     "ID":[{"_":"VAT"}],
     "TaxTypeCode":[{"_":"VAT"}]
    }]
   }],
   "Contact":[{
    "Name":[{"_":"Mrs Bouquet"}],
    "Telephone":[{"_":"0158 1233714"}],
    "Telefax":[{"_":"0158 1233856"}],
    "ElectronicMail":[{"_":"bouquet@fpconsortial.co.uk"}]
   }]
  }]
 }],
 "BuyerCustomerParty":[{
  "CustomerAssignedAccountID":[{"_":"XFB01"}],
  "SupplierAssignedAccountID":[{"_":"GT00978567"}],
  "Party":[{
   "PartyName":[{
    "Name":[{"_":"IYT Corporation"}]
   }],
   "PostalAddress":[{
    "StreetName":[{"_":"Avon Way"}],
    "BuildingName":[{"_":"Thereabouts"}],
    "BuildingNumber":[{"_":"56A"}],
    "CityName":[{"_":"Bridgtow"}],
    "PostalZone":[{"_":"ZZ99 1ZZ"}],
    "CountrySubentity":[{"_":"Avon"}],
    "AddressLine":[{
     "Line":[{"_":"3rd Floor, Room 5"}]
    }],
    "Country":[{
     "IdentificationCode":[{"_":"GB"}]
    }]
   }],
   "PartyTaxScheme":[{
    "RegistrationName":[{"_":"Bridgtow District Council"}],
    "CompanyID":[{"_":"12356478"}],
    "ExemptionReason":[{"_":"Local Authority"}],
    "TaxScheme":[{
     "ID":[{"_":"UK VAT"}],
     "TaxTypeCode":[{"_":"VAT"}]
    }]
   }],
   "Contact":[{
    "Name":[{"_":"Mr Fred Churchill"}],
    "Telephone":[{"_":"0127 2653214"}],
    "Telefax":[{"_":"0127 2653215"}],
    "ElectronicMail":[{"_":"fred@iytcorporation.gov.uk"}]
   }]
  }]
 }],
 "OriginatorCustomerParty":[{
  "Party":[{
   "PartyName":[{
    "Name":[{"_":"The Terminus"}]
   }],
   "PostalAddress":[{
    "StreetName":[{"_":"Avon Way"}],
    "BuildingName":[{"_":"Thereabouts"}],
    "BuildingNumber":[{"_":"56A"}],
    "CityName":[{"_":"Bridgtow"}],
    "PostalZone":[{"_":"ZZ99 1ZZ"}],
    "CountrySubentity":[{"_":"Avon"}],
    "AddressLine":[{
     "Line":[{"_":"3rd Floor, Room 5"}]
    }],
    "Country":[{
     "IdentificationCode":[{"_":"GB"}]
    }]
   }],
   "PartyTaxScheme":[{
    "RegistrationName":[{"_":"Bridgtow District Council"}],
    "CompanyID":[{"_":"12356478"}],
    "ExemptionReason":[{"_":"Local Authority"}],
    "TaxScheme":[{
     "ID":[{"_":"UK VAT"}],
     "TaxTypeCode":[{"_":"VAT"}]
    }]
   }],
   "Contact":[{
    "Name":[{"_":"S Massiah"}],
    "Telephone":[{"_":"0127 98876545"}],
    "Telefax":[{"_":"0127 98876546"}],
    "ElectronicMail":[{"_":"smassiah@the-email.co.uk"}]
   }]
  }]
 }]
}]}